id,pain_name,industry,description,who_suffers,current_process,why_manual,pain_cost,pain_frequency,ai_solvability,solution_ease,market_size_signal,source_url,source_id,date_added,status
1,AI Workflow Automation Consulting,AI Freelancing,"Sell AI automation setups to small businesses using Zapier/Make/ChatGPT API. Connect CRMs, email, spreadsheets. Charge $75-200/hr or $2K-15K per project. Monthly retainers $500-2K/client.",Small businesses drowning in manual processes,Hiring full-time devs or doing it manually,Most small biz owners don't know these no-code AI tools exist and can't connect them,Very High,Weekly,High,High,Large,https://greyjournal.net/hustle/grow/ai-side-hustles-2026/,1,2026-03-22,validated
2,AI Prompt Engineering Consulting,AI Freelancing,"Train business teams to write effective prompts and build custom GPTs. Charge $200-500/hr for consulting or $2K-5K for half-day workshops. Zero startup cost.",Companies struggling to get good AI outputs,Trial and error with ChatGPT or ignoring AI entirely,Prompt engineering is a new skill most employees lack; companies will pay to upskill teams,High,Weekly,High,High,Large,https://greyjournal.net/hustle/grow/ai-side-hustles-2026/,1,2026-03-22,validated
3,AI Chatbot Building for Small Businesses,AI Freelancing,"Build customer service chatbots using no-code platforms (Botpress/Voiceflow/CustomGPT). Charge $1K-5K per bot plus $200-500/mo maintenance. Recurring revenue model.",Small businesses wanting website chatbots,No chatbot or using expensive enterprise solutions,No-code platforms made this accessible but business owners don't know how to use them,High,Monthly,High,Medium,Large,https://greyjournal.net/hustle/grow/ai-side-hustles-2026/,1,2026-03-22,scored
4,AI-Enhanced Niche Content Writing,AI Freelancing,"Use AI to 3x output speed in a specialized vertical (healthcare/fintech/legal/SaaS). Charge $0.15-0.50/word vs commodity AI content at $0.03-0.05/word. Combine domain expertise with AI tools.",Agencies and businesses needing expert content,Hiring expensive specialists or getting generic AI slop,Generalist AI content is commoditized; the edge is domain expertise + AI speed,High,Daily,High,High,Medium,https://greyjournal.net/hustle/grow/ai-side-hustles-2026/,1,2026-03-22,validated
5,AI-Powered Design Subscription Service,AI Freelancing,"Use Midjourney/DALL-E/Canva AI to offer branded image packages. Charge $500-1500/mo subscription for 20-30 branded images. Social media content suites and product mockups.",Brands and businesses needing visual content,Hiring designers at $50-100/hr or using stock photos,AI image tools let one person deliver studio-quality output; most brands haven't adopted yet,High,Monthly,High,Medium,Large,https://greyjournal.net/hustle/grow/ai-side-hustles-2026/,1,2026-03-22,scored
6,AI Voiceover Service on Fiverr,AI Freelancing,"Use ElevenLabs or Descript to generate professional voiceovers for YouTube/ads/training. Fast delivery and low cost vs human voiceover artists. Sell as gigs on Fiverr/Upwork.",YouTubers and eLearning creators and agencies,Hiring human voiceover artists at $100-500+ per project,AI voice tools now sound natural; most clients can't tell the difference,Medium,Weekly,High,High,Medium,https://www.alphaspherical.com/make-money-on-fiverr-and-upwork-with-these-ai-services-in-2025,2,2026-03-22,scored
7,AI Resume and LinkedIn Optimization Service,AI Freelancing,"Use ChatGPT to craft personalized resumes and cover letters. Design in Canva. Upsell LinkedIn profile optimization. High volume potential on Fiverr.",Job seekers and professionals and students,Writing resumes manually or using basic templates,AI personalization + design makes resumes stand out; most job seekers don't know how to prompt well,Medium,Daily,High,High,Large,https://www.alphaspherical.com/make-money-on-fiverr-and-upwork-with-these-ai-services-in-2025,2,2026-03-22,scored
8,AI Data Analysis and Excel Automation Service,AI Freelancing,"Use ChatGPT-4o or Excel AI to analyze data, automate spreadsheets, build dashboards for small businesses. Upsell monthly reporting retainers.",Small business owners and analysts,Manual Excel work or hiring expensive data analysts,AI can now do in minutes what took hours; most SMBs don't know this is possible,Medium,Weekly,High,High,Medium,https://www.alphaspherical.com/make-money-on-fiverr-and-upwork-with-these-ai-services-in-2025,2,2026-03-22,scored
9,AI Social Media Content Package,AI Freelancing,"Use Ocoya/Predis.ai to generate and schedule social media posts for clients. Sell monthly content packages. Bundle with strategy consulting.",Influencers and coaches and small brands,Manual content creation or hiring social media managers,AI tools can generate a month of content in hours; most small brands can't afford full-time SM managers,Medium,Monthly,High,High,Large,https://www.alphaspherical.com/make-money-on-fiverr-and-upwork-with-these-ai-services-in-2025,2,2026-03-22,scored
10,Canva Template Packs on Etsy/Gumroad,Digital Products,"Create and sell Canva template packs (social media, presentations, resumes, planners) on Etsy and Gumroad. Use AI to generate designs faster. Create once and sell repeatedly. Price $5-30 per pack.",Small business owners and content creators and job seekers,Designing from scratch or buying expensive custom design,Canva makes template creation easy; AI design tools speed up production; most buyers want ready-made templates they can customize,Medium,Daily,High,High,Large,https://www.shopify.com/blog/digital-products,6,2026-03-22,validated
11,Notion Template Store,Digital Products,"Build and sell Notion templates for specific use cases (project management, habit tracking, CRM, content calendars). Sell on Gumroad or own site. Price $5-50 per template.",Notion users wanting pre-built systems,Building Notion setups from scratch or using basic free templates,Growing Notion user base creates demand; most users lack time/skill to build complex systems; templates are infinitely scalable,Medium,Daily,Medium,High,Medium,https://www.thinkific.com/blog/digital-products-to-sell/,7,2026-03-22,scored
12,PLR Content Repurposing and Reselling,Digital Products,"Buy cheap PLR (Private Label Rights) ebooks/courses for $5-50. Rebrand with AI-generated covers and improved content. Resell at 5-20x markup on Gumroad/Etsy/own site.",People looking for quick digital products to consume,Creating content from scratch or buying at full price,PLR content is undervalued because most buyers don't rebrand it well; AI makes rebranding and improvement fast,Medium,Weekly,High,High,Medium,https://www.shopify.com/blog/digital-products,6,2026-03-22,scored
13,Niche Printable Digital Downloads on Etsy,Digital Products,"Create printable planners, checklists, wall art, and worksheets for specific niches using Canva/AI. Sell on Etsy at $2-15 each. High volume potential with SEO optimization.",Parents and teachers and planners and home decorators,Buying physical planners or creating their own,Digital printables have 90% margins; Etsy SEO drives organic traffic; AI design tools make production fast,Medium,Daily,High,High,Large,https://www.shopify.com/blog/digital-products,6,2026-03-22,scored
14,AI-Enhanced Online Mini-Courses,Digital Products,"Create short focused courses (1-3 hours) using AI to generate content outlines and scripts. Record with screen share or slides. Sell on Gumroad/Teachable at $19-97. Niche B2B topics command premium prices.",Professionals wanting specific skill upgrades,Expensive long-form courses or scattered free YouTube content,AI dramatically speeds up course creation; niche B2B topics have less competition; mini-courses have lower creation barrier,High,Monthly,High,Medium,Large,https://www.thinkific.com/blog/digital-products-to-sell/,7,2026-03-22,validated
15,Digital Product Bundle Flipping,Digital Products,"Buy undervalued digital product bundles (AppSumo/Humble Bundle/PLR sites). Identify highest-value items. Rebrand and resell individually at markup. Pure arbitrage play.",Digital product buyers wanting curated selections,Buying individual products at full price,Bundle deals create arbitrage opportunity; most buyers don't realize individual items have higher resale value; AI helps quickly assess and improve products,Medium,Weekly,Medium,High,Niche,https://ecommerceceo.com/sell-digital-products/,8,2026-03-22,scored
16,Amazon Online Arbitrage via FBA,Marketplace Arbitrage,"Use tools like Tactical Arbitrage or BuyBotPro to scan retail sites for products priced below Amazon selling price. Buy low and ship to Amazon FBA warehouses. Amazon handles fulfillment. Proven model with £1M+ sellers.",Amazon shoppers buying at retail prices,Buying products at normal retail prices from Amazon,Price discrepancies exist across platforms and retail clearance; tools automate finding these gaps; Amazon FBA handles logistics,High,Daily,Medium,Medium,Massive,https://www.repricerexpress.com/online-arbitrage-amazon/,10,2026-03-22,validated
17,Cross-Platform Price Arbitrage (eBay/Walmart to Amazon),Marketplace Arbitrage,"Find products cheaper on Walmart.com or eBay and list them on Amazon at higher prices. Use repricing tools to stay competitive. Can be done without holding inventory via dropshipping or with FBA prep services.",Amazon buyers paying retail premiums,Buying from Amazon at full price without comparing other platforms,Platform price differences persist because most buyers don't cross-shop; repricing tools keep margins optimized,Medium,Daily,Medium,Medium,Large,https://www.webretailer.com/b/online-arbitrage/,11,2026-03-22,scored
18,Clearance/Liquidation Flipping on Amazon,Marketplace Arbitrage,"Buy clearance and liquidation inventory from retail stores and liquidation sites (Bulq/DirectLiquidation). List profitable items on Amazon FBA at full retail price. High margins on discontinued/seasonal items.",Amazon shoppers wanting specific products,Buying at regular retail prices,Clearance items are often 50-90% below retail; most buyers don't know about liquidation channels; Amazon FBA makes selling easy,High,Weekly,Low,Medium,Large,https://www.repricerexpress.com/online-arbitrage-amazon/,10,2026-03-22,scored
19,AI-Powered Arbitrage Scanning Service,Marketplace Arbitrage,"Build or use AI tools to scan multiple platforms for price discrepancies automatically. Offer this as a service to other arbitrage sellers. Charge monthly subscription for leads/deals lists.",Online arbitrage sellers needing product leads,Manual scanning or using expensive existing tools,AI can process thousands of listings faster than existing tools; most arbitrage sellers spend hours scanning manually,High,Monthly,High,Medium,Medium,https://www.webretailer.com/b/online-arbitrage/,11,2026-03-22,scored
20,AI Automation Agency (Productized Service),AI Automation Agency,"Scale beyond freelancing: build a small AI automation agency with fixed-price packages. Focus on one vertical (real estate, dental, e-commerce). Use VAs for delivery. Charge $2K-15K per project + $500-2K/mo retainers. Target $10-25K/mo within 6-12 months.",Small businesses needing AI workflow automation,Hiring expensive developers or doing things manually,Most businesses know they need AI but can't implement it; agencies bridge this gap with productized packages,Very High,Weekly,High,Medium,Large,https://greyjournal.net/hustle/grow/ai-side-hustles-2026/,15,2026-03-22,validated
21,AI Lead Follow-Up Systems for Specific Industries,AI Automation Agency,"Build AI-powered lead follow-up automation for a specific industry (real estate agents, insurance, contractors). Use ChatGPT API + Zapier/Make to auto-respond to leads. Sell as $500-2K setup + $200-500/mo retainer.",Business owners losing leads due to slow follow-up,Manual email/phone follow-up or no follow-up at all,Speed-to-lead is proven to increase conversion 5-10x; most small businesses respond to leads in hours not minutes; AI can respond instantly,High,Daily,High,High,Large,https://greyjournal.net/hustle/grow/ai-side-hustles-2026/,15,2026-03-22,validated
22,AI-Powered Client Proposal and Report Generator,AI Automation Agency,"Build AI templates that generate client proposals and reports from structured inputs. Sell as a SaaS tool or service to agencies and consultants. Price $50-200/mo subscription or $500-2K per custom setup.",Agencies and consultants spending hours on proposals,Writing proposals manually from scratch each time,AI can generate 80% of a proposal from templates and client data; most agencies waste 5-10 hours per proposal,Medium,Weekly,High,High,Medium,https://greyjournal.net/hustle/grow/ai-side-hustles-2026/,15,2026-03-22,scored
23,Faceless AI YouTube Channel,Content Monetization,"Create faceless YouTube channels using ChatGPT for scripts + Pictory/InVideo for video generation + ElevenLabs for voiceover. Focus on niches: motivation, tech news, finance, AI tools, productivity. Monetize via ads, affiliate links, and digital products.",YouTube viewers in specific niches,Watching content from traditional face-on-camera creators,AI tools now enable full video production without showing face or using own voice; one person can produce 50+ videos/month,High,Daily,High,Medium,Large,https://tachilink.com/making-money-with-ai-reddit/,20,2026-03-22,scored
24,AI-Powered Niche Blog with Affiliate Marketing,Content Monetization,"Build niche blogs using ChatGPT/Claude for content + SurferSEO for optimization. Target low-competition long-tail keywords. Monetize via affiliate links to AI tools and digital products. Automate with Pinterest/social promotion.",People searching for niche information and product reviews,Reading scattered free content or outdated blog posts,AI enables one person to produce 10-20 quality articles/week in a niche; affiliate commissions from AI tools are high (20-50%),Medium,Daily,High,High,Medium,https://newzyatra.com/how-to-make-money-with-ai-in-2025/,21,2026-03-22,validated
25,AI Newsletter Business,Content Monetization,"Start a niche newsletter using AI to curate and write content. Grow via social media and cross-promotions. Monetize via sponsorships ($25-100+ per 1000 subscribers) and affiliate links. Beehiiv/Substack/ConvertKit for platform. Target: 5K-50K subscribers.",Professionals wanting curated niche insights,Following dozens of sources manually or subscribing to generic newsletters,AI can curate and summarize from many sources instantly; newsletter businesses sell for 20-40x monthly revenue on acquisition marketplaces,High,Weekly,High,Medium,Medium,https://tachilink.com/making-money-with-ai-reddit/,20,2026-03-22,validated
26,AI-Generated Digital Product Store (Coloring Books/Planners),Content Monetization,"Use Midjourney/DALL-E to create coloring books, planners, journals, and wall art. Publish on Amazon KDP and Etsy. AI generates hundreds of unique designs quickly. Price at $2-15 per product.",Parents, hobbyists, productivity enthusiasts,Buying mass-produced generic planners and coloring books,AI generates unique designs in minutes vs hours of manual design; Amazon KDP has zero upfront cost; volume play across many products,Medium,Daily,High,High,Large,https://tachilink.com/making-money-with-ai-reddit/,20,2026-03-22,scored
