id,url,domain,industry,date_explored,findings_count,quality,notes
1,https://greyjournal.net/hustle/grow/ai-side-hustles-2026/,greyjournal.net,AI Freelancing,2026-03-22,5,High,"Detailed 2026 AI side hustle breakdown with real earnings data. AI automation consulting $75-200/hr, prompt engineering $200-500/hr, AI chatbot building $1K-5K/bot, AI content services, AI design services."
2,https://www.alphaspherical.com/make-money-on-fiverr-and-upwork-with-these-ai-services-in-2025,alphaspherical.com,AI Freelancing,2026-03-22,4,Medium,"List of 10 AI services for Fiverr/Upwork. Practical gig setup tips. Covers prompt writing, AI voiceovers, AI resume writing, data/Excel automation."
3,https://medium.com/write-a-catalyst/how-to-actually-make-money-with-ai-in-2025-the-7-tool-playbook-002824091325,medium.com,AI Freelancing,2026-03-22,2,Medium,"7-tool AI playbook for freelancers. Focuses on content/copywriting with ChatGPT/Claude and solving business problems."
4,https://freeacademy.ai/blog/making-money-with-ai-tools-freelancer-2026,freeacademy.ai,AI Freelancing,2026-03-22,0,Low,"Page failed to load/parse. No findings extracted."
5,https://www.reddit.com/r/ArtificialInteligence/comments/18k9tf6/how_are_you_making_money_with_ai/,reddit.com,AI Freelancing,2026-03-22,0,Low,"Blocked by robots.txt. Could not fetch."
6,https://www.shopify.com/blog/digital-products,shopify.com,Digital Products,2026-03-22,3,High,"Comprehensive guide to selling digital products. $124B market in 2025. 90% profit margins. Covers courses, ebooks, templates, printables, AI-enhanced products, membership sites."
7,https://www.thinkific.com/blog/digital-products-to-sell/,thinkific.com,Digital Products,2026-03-22,3,Medium,"Best digital products to sell in 2025. Good breakdown of eLearning, templates, stock media, printables, AI-driven tools. Includes tool recommendations per category."
8,https://ecommerceceo.com/sell-digital-products/,ecommerceceo.com,Digital Products,2026-03-22,1,Medium,"Guide on selling digital vs physical products. Covers ebooks, courses, SaaS. Good comparison but less actionable for quick wins."
9,https://www.sidehustlenation.com/selling-digital-products/,sidehustlenation.com,Digital Products,2026-03-22,1,Medium,"B2B online course case study. Niche training for librarians generating recurring revenue. Useful model for niche B2B digital products."
10,https://www.repricerexpress.com/online-arbitrage-amazon/,repricerexpress.com,Marketplace Arbitrage,2026-03-22,2,Medium,"Q&A from experienced Amazon OA seller. £1M+ in sales since 2015. Covers product selection, Tactical Arbitrage tool, sourcing assistants, category ungating. Practical but dated (2018)."
11,https://www.webretailer.com/b/online-arbitrage/,webretailer.com,Marketplace Arbitrage,2026-03-22,2,Medium,"Comprehensive guide to online arbitrage product sourcing tools. Covers Tactical Arbitrage, BuyBotPro, SourceMogul. Good overview of the business model and tooling."
12,https://www.junglescout.com/blog/online-arbitrage/,junglescout.com,Marketplace Arbitrage,2026-03-22,0,Low,"Too many redirects. Could not fetch."
13,https://www.sellerapp.com/blog/amazon-arbitrage/,sellerapp.com,Marketplace Arbitrage,2026-03-22,0,Low,"404 Not Found."
14,https://amzscout.net/blog/online-arbitrage-on-amazon/,amzscout.net,Marketplace Arbitrage,2026-03-22,0,Low,"404 Not Found."
15,https://greyjournal.net/hustle/grow/ai-side-hustles-2026/ (continued),greyjournal.net,AI Automation Agency,2026-03-22,3,High,"Detailed step-by-step path from zero to AI agency. Week-by-week breakdown. FTC warnings on scams. Key data: $674B gig economy, beginners reach $500-1K/mo in 6 months, top operators $10-25K/mo."
16,https://glaziang.com/ai-jobs-and-freelancing-how-people-are-making-money-in-2025/,glaziang.com,AI Automation Agency,2026-03-22,1,Low,"General overview of AI jobs and freelancing trends in 2025. Broad categories, not specific to agency model."
17,https://www.morningscore.io/ai-automation-agency/,morningscore.io,AI Automation Agency,2026-03-22,0,Low,"404 Not Found."
18,https://zapier.com/blog/ai-automation-business/,zapier.com,AI Automation Agency,2026-03-22,0,Low,"404 Not Found."
19,https://www.n8n.io/blog/start-ai-automation-agency/,n8n.io,AI Automation Agency,2026-03-22,0,Low,"404 Not Found."
